fonte,codigo,titulo,tipo,subtipo,finalidade,preco_locacao,preco_venda,valor_condominio,valor_iptu,bairro,cidade,estado,endereco,latitude,longitude,dormitorios,suites,banheiros,garagens,area_total,area_construida,area_util,area_terreno,descricao,url
Abias,11544,Apartamento 2 Quartos Parque Arnold Schimidt 60m²,Apartamento,,Locacao,"1.500,00",,"676,00","100,00",Parque Arnold Schimidt,São Carlos,SP,,,,2,,,1,,,60,,"Descubra o seu novo lar no encantador Parque Arnold Schimidt, em São Carlos! Este apartamento no Edifício Rossete oferece 60 m² de área útil, ideal para quem busca conforto e praticidade. Com 2 dormitórios bem distribuídos, este imóvel é perfeito para famílias ou casais que desejam um espaço aconchegante e funcional. A localização privilegiada proporciona fácil acesso a comércios, escolas e áreas de lazer, tornando o dia a dia muito mais conveniente.
O apartamento conta com uma ampla sala de estar e jantar, perfeita para receber amigos e familiares. A cozinha ampla e a área de serviço garantem que sua rotina seja ainda mais prática. Além disso, o imóvel possui 2 banheiros, incluindo um W.C. de empregada, proporcionando mais conforto e privacidade.
Para completar, o Edifício Rossete oferece uma série de comodidades, como elevador, portão eletrônico e um salão de festas, ideal para comemorações e eventos. E não se preocupe com o estacionamento, pois o apartamento também conta com uma garagem. Não perca a oportunidade de viver em um lugar que une conforto, segurança e praticidade. Agende uma visita e venha conhecer o seu novo lar!
Os valores de condomínio e taxas são aproximados. Além do aluguel, será de responsabilidade do locatário o pagamento do condomínio mais as despesas ordinárias, IPTU, Seguro incêndio, energia elétrica e demais encargos previstos nos artigos 22 e 23 da Lei nº 8.245/91.",https://abiasimoveis.com.br/imovel/11544/apartamento-2-quartos-edificio-rossete-parque-arnold-schimidt-sao-carlos/
Abias,13357,Apartamento 2 Quartos Vila Lutfalla 60m²,Apartamento,,Locacao,"1.889,00",,"400,00","80,00",Vila Lutfalla,São Carlos,SP,,,,2,,,1,,,60,,"Se você está buscando um apartamento para alugar em São Carlos, não perca esta excelente oportunidade no Edifício Sonata, localizado na tranquila Vila Lutfalla. Com 60 m² de área útil, este imóvel para locação oferece o conforto ideal para quem deseja praticidade e qualidade de vida. O apartamento possui 2 dormitórios bem distribuídos, banheiro social, sala de estar e jantar integradas, além de uma sacada que proporciona ótima iluminação natural e ventilação.
O imóvel conta com cozinha funcional, área de serviço independente e uma vaga de garagem. O condomínio conta com portão eletrônico, elevador, portaria 24 horas, garantindo segurança e comodidade para sua família. Para quem gosta de lazer, o edifício oferece churrasqueira, playground, quadra esportiva e um amplo salão de festas, perfeitos para momentos de descontração e confraternização.
Alugue este apartamento e viva em um dos bairros mais valorizados de São Carlos, com fácil acesso a comércios, escolas e serviços essenciais. A locação deste imóvel é uma excelente escolha para quem procura praticidade, segurança e qualidade de vida. Não perca tempo e agende já sua visita para conhecer de perto todas as vantagens de morar no Edifício Sonata!
Descubra o Edifício Sonata, um empreendimento moderno e completo localizado no bairro Vila Lutfalla, uma das regiões mais valorizadas de São Carlos. Este apartamento oferece o máximo em conforto, segurança e lazer, proporcionando qualidade de vida para toda a família. Entre os diferenciais do condomínio estão portaria 24 horas, portão eletrônico e elevador, garantindo praticidade e tranquilidade aos moradores. O empreendimento também conta com uma excelente infraestrutura de lazer, incluindo churrasqueira, playground, quadra poliesportiva e salão de festas, ideais para momentos de descontração e convivência.
O Edifício Sonata se destaca no mercado imobiliário de São Carlos por sua localização estratégica, próxima a escolas, supermercados, comércios e serviços essenciais. Morar neste apartamento é investir em bem-estar, segurança e comodidade, além de estar em um condomínio que valoriza o convívio social e o lazer dos seus residentes. Aproveite esta oportunidade de viver em um dos melhores empreendimentos da cidade, com todas as facilidades e benefícios que você e sua família merecem.
Os valores de condomínio e taxas são aproximados. Além do aluguel, será de responsabilidade do locatário o pagamento do condomínio mais as despesas ordinárias, IPTU, Seguro incêndio, energia elétrica e demais encargos previstos nos artigos 22 e 23 da Lei nº 8.245/91.",https://abiasimoveis.com.br/imovel/13357/apartamento-2-quartos-edificio-sonata-vila-lutfalla-sao-carlos/
Abias,13356,Apartamento 2 Quartos Vila Lutfalla 60m²,Apartamento,,Locacao,"1.889,00",,"400,00","80,00",Vila Lutfalla,São Carlos,SP,,,,2,,,2,,,60,,"Excelente oportunidade de aluguel em São Carlos! Este apartamento para locação está situado no Edifício Sonata, no bairro Vila Lutfalla, uma região tranquila e valorizada da cidade. Com 60m² de área útil, o imóvel oferece dois dormitórios bem distribuídos, sala de estar e jantar integradas, além de uma sacada que proporciona ótima iluminação natural. Ideal para quem busca conforto e praticidade em um ambiente acolhedor.
O apartamento disponível para alugar conta ainda com cozinha ampla, área de serviço, banheiro social e uma vaga de garagem com portão eletrônico, garantindo segurança e comodidade. O condomínio oferece infraestrutura completa com elevador, portaria 24 horas, salão de festas, churrasqueira, playground e quadra esportiva, proporcionando lazer e segurança para toda a família.
Não perca a chance de morar em um dos melhores endereços de São Carlos! Agende já sua visita e conheça de perto esta excelente opção de locação residencial. O Edifício Sonata está próximo a comércios, escolas, supermercados e possui fácil acesso às principais vias da cidade, tornando o processo de alugar seu novo lar ainda mais prático. Aproveite essa oportunidade e faça do seu próximo endereço um lugar especial para viver!
Descubra o Edifício Sonata, um empreendimento moderno e completo localizado no bairro Vila Lutfalla, uma das regiões mais valorizadas de São Carlos. Este apartamento oferece o máximo em conforto, segurança e lazer, proporcionando qualidade de vida para toda a família. Entre os diferenciais do condomínio estão portaria 24 horas, portão eletrônico e elevador, garantindo praticidade e tranquilidade aos moradores. O empreendimento também conta com uma excelente infraestrutura de lazer, incluindo churrasqueira, playground, quadra poliesportiva e salão de festas, ideais para momentos de descontração e convivência.
O Edifício Sonata se destaca no mercado imobiliário de São Carlos por sua localização estratégica, próxima a escolas, supermercados, comércios e serviços essenciais. Morar neste apartamento é investir em bem-estar, segurança e comodidade, além de estar em um condomínio que valoriza o convívio social e o lazer dos seus residentes. Aproveite esta oportunidade de viver em um dos melhores empreendimentos da cidade, com todas as facilidades e benefícios que você e sua família merecem.
Os valores de condomínio e taxas são aproximados. Além do aluguel, será de responsabilidade do locatário o pagamento do condomínio mais as despesas ordinárias, IPTU, Seguro incêndio, energia elétrica e demais encargos previstos nos artigos 22 e 23 da Lei nº 8.245/91.",https://abiasimoveis.com.br/imovel/13356/apartamento-2-quartos-edificio-sonata-vila-lutfalla-sao-carlos/
Abias,12575,Casa 2 Quartos Vila Prado 109m²,Casa,,Locacao,"2.223,00",,.,"80,00",Vila Prado,São Carlos,SP,,,,2,,,2,,,109,,"Excelente oportunidade de aluguel em São Carlos! Esta casa para locação está localizada no bairro Vila Prado, uma região tradicional e valorizada, próxima a escolas, supermercados, comércios e com fácil acesso ao transporte público. Com 109 m² de área útil e 160 m² de terreno, o imóvel oferece um espaço amplo e bem distribuído, perfeito para quem busca conforto e praticidade para a família.
O imóvel conta com 2 dormitórios arejados, 2 banheiros, sala espaçosa, cozinha funcional e área de serviço. Os ambientes são bem iluminados e proporcionam uma ótima circulação de ar, garantindo bem-estar em todos os cômodos. A casa também possui quintal, ideal para momentos de lazer e convivência, além de garantir mais privacidade aos moradores.
Se você está procurando uma casa para alugar em São Carlos, essa é a opção ideal para quem deseja morar em uma localização privilegiada, com segurança e tranquilidade. Aproveite esta oportunidade de locação em Vila Prado e agende uma visita para conhecer de perto todos os diferenciais deste imóvel disponível para aluguel. Entre em contato e faça já sua proposta!
Os valores de condomínio e taxas são aproximados. Além do aluguel, será de responsabilidade do locatário o pagamento do condomínio mais as despesas ordinárias, IPTU, Seguro incêndio, energia elétrica e demais encargos previstos nos artigos 22 e 23 da Lei nº 8.245/91.",https://abiasimoveis.com.br/imovel/12575/casa-2-quartos-vila-prado-sao-carlos/
Abias,13271,Apartamento 1 Quarto Jardim Paraíso 35m²,Apartamento,,Locacao,"2.000,00",,"262,21","55,27",Jardim Paraíso,São Carlos,SP,,,,1,,,1,,,35,,"Se você está buscando um apartamento para alugar em São Carlos, o Edifício Plus Suite, localizado no bairro Jardim Paraíso, é a escolha ideal. Com 35 m² de área útil, este imóvel oferece praticidade e conforto em cada detalhe, sendo perfeito para estudantes, profissionais ou casais que desejam morar próximo à USP, Portaria Observatório e Av. Dr. Carlos Botelho. A localização estratégica facilita o acesso aos principais pontos da cidade, além de contar com opções de transporte, comércio e serviços ao redor.
O apartamento disponível para locação possui 1 dormitório, banheiro social, sala de estar aconchegante e sacada, proporcionando um ambiente agradável para relaxar ou receber visitas. A cozinha conta com armários planejados e área de serviço integrada, otimizando o espaço e tornando o dia a dia mais prático. O imóvel está mobiliado, pronto para morar, e oferece ainda uma vaga de garagem, além de portão eletrônico, garantindo segurança e comodidade para os moradores.
O condomínio dispõe de elevador, facilitando o acesso a todos os andares, e possui uma infraestrutura moderna, pensada para atender às necessidades de quem busca alugar um apartamento em São Carlos com qualidade de vida. Não perca a oportunidade de garantir seu novo lar em um dos bairros mais valorizados da cidade. Entre em contato e agende uma visita para conhecer esse excelente imóvel disponível para locação no Jardim Paraíso.
Descubra o conforto e a praticidade de morar no Edifício Plus Suite, um empreendimento moderno localizado no bairro Jardim Paraíso, em São Carlos. Este apartamento oferece uma excelente infraestrutura, com portão eletrônico, portaria 24 horas e fácil acesso a pontos estratégicos da cidade, como a USP – Portaria IFSC, USP – Portaria Observatório, Igreja Nossa Senhora de Fátima e a movimentada Avenida Dr. Carlos Botelho. Ideal para quem busca segurança, comodidade e proximidade com importantes centros educacionais e comerciais da região.
O Edifício Plus Suite conta com áreas de lazer completas, incluindo churrasqueira e salão de festas, perfeitos para momentos de confraternização com amigos e familiares. O condomínio oferece ainda um ambiente tranquilo e seguro, proporcionando qualidade de vida para toda a família. Aproveite esta oportunidade única de morar em um dos melhores apartamentos à venda em São Carlos, em um bairro valorizado, com infraestrutura completa e excelente localização. Agende já sua visita e conheça todas as vantagens deste imóvel!
Os valores de condomínio e taxas são aproximados. Além do aluguel, será de responsabilidade do locatário o pagamento do condomínio mais as despesas ordinárias, IPTU, Seguro incêndio, energia elétrica e demais encargos previstos nos artigos 22 e 23 da Lei nº 8.245/91.",https://abiasimoveis.com.br/imovel/13271/apartamento-1-quarto-edificio-plus-suite-jardim-paraiso-sao-carlos/
Abias,13340,Apartamento 1 Quarto Jardim Paraiso 35m²,Apartamento,,Locacao,"2.000,00",,"263,00","55,27",Jardim Paraiso,São Carlos,SP,,,,1,,,1,,,35,,"Encontre o apartamento ideal para aluguel no Jardim Paraíso, em São Carlos! Localizado no Edifício Plus Suite, este imóvel apresenta 35m² de área útil, perfeito para quem busca praticidade e conforto em um ambiente moderno e funcional. Com 1 dormitório, banheiro social, sala de estar aconchegante e cozinha equipada com armários, este apartamento para locação atende às necessidades de estudantes, profissionais e casais que desejam morar próximo à USP, Portaria Observatório e Av. Dr. Carlos Botelho.
O condomínio oferece infraestrutura completa para seu lazer e segurança, contando com portão eletrônico, elevador, salão de festas e churrasqueira, ideais para receber amigos e familiares. Além disso, a área de serviço e a vaga de garagem proporcionam ainda mais comodidade no dia a dia. Morar neste apartamento para alugar significa garantir qualidade de vida, praticidade e fácil acesso aos principais pontos da cidade de São Carlos.
Não perca a oportunidade de alugar este excelente apartamento no Jardim Paraíso. Aproveite todos os benefícios de morar em um imóvel bem localizado, seguro e com diversas opções de lazer. Agende uma visita e venha conhecer de perto tudo o que este apartamento para locação pode oferecer para você!
Descubra o conforto e a praticidade de morar no Edifício Plus Suite, um empreendimento moderno localizado no bairro Jardim Paraíso, em São Carlos. Este apartamento oferece uma excelente infraestrutura, com portão eletrônico, portaria 24 horas e fácil acesso a pontos estratégicos da cidade, como a USP – Portaria IFSC, USP – Portaria Observatório, Igreja Nossa Senhora de Fátima e a movimentada Avenida Dr. Carlos Botelho. Ideal para quem busca segurança, comodidade e proximidade com importantes centros educacionais e comerciais da região.
O Edifício Plus Suite conta com áreas de lazer completas, incluindo churrasqueira e salão de festas, perfeitos para momentos de confraternização com amigos e familiares. O condomínio oferece ainda um ambiente tranquilo e seguro, proporcionando qualidade de vida para toda a família. Aproveite esta oportunidade única de morar em um dos melhores apartamentos à venda em São Carlos, em um bairro valorizado, com infraestrutura completa e excelente localização. Agende já sua visita e conheça todas as vantagens deste imóvel!
Os valores de condomínio e taxas são aproximados. Além do aluguel, será de responsabilidade do locatário o pagamento do condomínio mais as despesas ordinárias, IPTU, Seguro incêndio, energia elétrica e demais encargos previstos nos artigos 22 e 23 da Lei nº 8.245/91.",https://abiasimoveis.com.br/imovel/13340/apartamento-1-quarto-edificio-plus-suite-jardim-paraiso-sao-carlos/
Abias,13403,Apartamento 2 Quartos Centro 60m²,Apartamento,,Locacao,"1.889,00",,"382,85","55,00",Centro,São Carlos,SP,,,,2,,,1,,,60,,"Ótima oportunidade de aluguel no coração de São Carlos! Este apartamento para locação está localizado no Edifício Analli, no Centro da cidade, oferecendo praticidade e fácil acesso a comércios, serviços e à USP, Portaria Observatório, na Av. Dr. Carlos Botelho. Com 60m² de área útil, o imóvel é ideal para quem busca conforto e comodidade em um dos melhores bairros para alugar em São Carlos.
O apartamento conta com 2 dormitórios bem iluminados, sala de estar e sala de jantar integradas, além de uma sacada que proporciona excelente ventilação natural. A cozinha possui armários, área de serviço separada e o banheiro é funcional e bem distribuído. O imóvel ainda dispõe de garagem, portão eletrônico e elevador, garantindo praticidade e segurança para o seu dia a dia.
Se você procura um apartamento para alugar no Centro de São Carlos, essa é a escolha perfeita! O Edifício Analli oferece toda a infraestrutura necessária para uma vida tranquila, com fácil acesso a transporte público, supermercados, escolas e universidades. Agende já sua visita e aproveite esta excelente opção de locação residencial na melhor região da cidade.
Descubra o conforto de viver no coração de São Carlos! Este excelente apartamento de 60m² no Edifício Analli oferece a combinação perfeita entre praticidade e bem-estar. Com dois dormitórios bem distribuídos, sala de estar e jantar integradas, além de uma sacada aconchegante, você terá espaços ideais para relaxar e receber amigos e familiares.
A cozinha planejada, equipada com armários, área de serviço funcional e banheiro moderno, garantem praticidade no dia a dia. O apartamento conta ainda com garagem coberta, portão eletrônico e elevador, proporcionando segurança e acessibilidade para toda a família. O prédio está localizado próximo à USP, portaria Observatório, e à Avenida Dr. Carlos Botelho, uma das regiões mais valorizadas e bem servidas de São Carlos.
More em um dos melhores endereços do Centro, com fácil acesso a supermercados, escolas, restaurantes e tudo o que você precisa para viver com qualidade. Não perca a chance de morar em um empreendimento completo, seguro e com toda a comodidade que você merece. Agende uma visita e venha conhecer seu novo lar no Edifício Analli!
Os valores de condomínio e taxas são aproximados. Além do aluguel, será de responsabilidade do locatário o pagamento do condomínio mais as despesas ordinárias, IPTU, Seguro incêndio, energia elétrica e demais encargos previstos nos artigos 22 e 23 da Lei nº 8.245/91.",https://abiasimoveis.com.br/imovel/13403/apartamento-2-quartos-edificio-analli-centro-sao-carlos/
Abias,13425,Casa 3 Quartos Jardim Bandeirantes 110m²,Casa,,Locacao,"2.223,00",,.,"120,00",Jardim Bandeirantes,São Carlos,SP,,,,3,1,,6,,,110,,"Ótima oportunidade de aluguel em São Carlos! Esta casa para locação está situada no bairro Jardim Bandeirantes, uma região tranquila e com fácil acesso aos principais pontos da cidade. Com 110 m² de área útil, o imóvel oferece ambientes amplos e bem distribuídos, ideal para quem busca conforto e praticidade ao alugar uma casa em São Carlos.
A residência conta com 3 dormitórios, sendo 1 suíte, além de 2 banheiros, proporcionando mais comodidade para toda a família. A cozinha com armário, perfeita para quem valoriza organização e funcionalidade no dia a dia. O imóvel possui ainda sala de estar aconchegante, área de serviço, garagem, quintal espaçoso e uma excelente churrasqueira, ideal para momentos de lazer e confraternização.
Se você procura uma casa para alugar em Jardim Bandeirantes, esta é a escolha certa! Aproveite esta oportunidade de locação e viva com qualidade em um imóvel completo, pronto para receber você e sua família. Entre em contato e agende uma visita para conhecer de perto todos os diferenciais que este imóvel para aluguel em São Carlos pode oferecer.
Os valores de condomínio e taxas são aproximados. Além do aluguel, será de responsabilidade do locatário o pagamento do condomínio mais as despesas ordinárias, IPTU, Seguro incêndio, energia elétrica e demais encargos previstos nos artigos 22 e 23 da Lei nº 8.245/91.",https://abiasimoveis.com.br/imovel/13425/casa-3-quartos-jardim-bandeirantes-sao-carlos/
Abias,11937,Apartamento 3 Quartos Centro 70m²,Apartamento,,Locacao,"1.900,00",,"365,00","90,00",Centro,São Carlos,SP,,,,3,,,1,,,70,,"Excelente oportunidade de aluguel no coração de São Carlos! Este apartamento para locação está localizado no Edifício Leonor Humberto Pian, em uma das regiões mais valorizadas da cidade, próximo à USP e à Av. Dr. Carlos Botelho. Com 70m² de área útil, o imóvel oferece ambientes bem distribuídos, ideal para quem busca conforto e praticidade no dia a dia.
O apartamento conta com três dormitórios, dois banheiros, sala de estar e sala de jantar integradas, proporcionando um espaço aconchegante para receber amigos e familiares. A cozinha possui armários, área de serviço funcional e uma sacada que garante ótima ventilação e iluminação natural. Além disso, o imóvel dispõe de garagem, portão eletrônico e elevador, agregando ainda mais segurança e comodidade para sua rotina.
Não perca a chance de alugar este apartamento em localização privilegiada no Centro de São Carlos. Com fácil acesso a comércios, universidades e serviços, esta é a escolha perfeita para quem deseja praticidade e qualidade de vida. Agende uma visita e garanta já seu novo lar para locação!
Descubra o conforto e a praticidade de morar no coração de São Carlos com o Edifício Leonor Humberto Pian, localizado no Centro da cidade. Este apartamento à venda oferece uma localização privilegiada, próximo à USP e à Portaria Observatório na Av. Dr. Carlos Botelho, facilitando o acesso a universidades, comércio, serviços e opções de lazer. O empreendimento conta com portão eletrônico, proporcionando segurança e comodidade aos moradores, além de elevador para garantir acessibilidade a todos os ambientes do edifício.
Ideal para quem busca qualidade de vida e valorização imobiliária, o Edifício Leonor Humberto Pian destaca-se pelo excelente padrão de construção e infraestrutura completa. Aproveite a oportunidade de viver em um dos bairros mais desejados de São Carlos, com fácil acesso ao transporte público, escolas, supermercados e centros de saúde. Invista em um apartamento no Centro de São Carlos e garanta conforto, segurança e praticidade no seu dia a dia.
Os valores de condomínio e taxas são aproximados. Além do aluguel, será de responsabilidade do locatário o pagamento do condomínio mais as despesas ordinárias, IPTU, Seguro incêndio, energia elétrica e demais encargos previstos nos artigos 22 e 23 da Lei nº 8.245/91.",https://abiasimoveis.com.br/imovel/11937/apartamento-3-quartos-edificio-leonor-humberto-pian-centro-sao-carlos/
Abias,13415,Apartamento 2 Quartos Parque Faber Castell II 45m²,Apartamento,,Locacao,"1.889,00",,"400,00","100,00",Parque Faber Castell II,São Carlos,SP,,,,2,,,1,,,45,,"Excelente oportunidade de aluguel em São Carlos! Este apartamento para locação está localizado no Edifício Monte dos Pinheiros, no bairro Parque Faber Castell II, uma região tranquila e valorizada da cidade. Com 45m² de área útil, o imóvel possui 2 dormitórios, banheiro social, sala de estar e jantar integradas, além de cozinha funcional e área de serviço. Ideal para quem busca praticidade e conforto em um ambiente moderno e bem distribuído.
O apartamento para alugar conta com armários, vaga de garagem, portão eletrônico e acesso por elevador, garantindo segurança e comodidade aos moradores. O condomínio oferece uma infraestrutura completa com portaria 24 horas, salão de festas para confraternizações, churrasqueira, piscina, playground para as crianças e áreas comuns bem cuidadas, proporcionando lazer e tranquilidade para toda a família.
Se você procura um imóvel para locação em São Carlos, esta é a escolha perfeita para quem deseja morar bem, com fácil acesso a comércios, escolas e serviços essenciais. Aproveite essa chance de alugar um apartamento em um dos melhores bairros da cidade, com excelente custo-benefício e qualidade de vida. Agende sua visita e venha conhecer de perto tudo o que este imóvel tem a oferecer!
Descubra o conforto e a praticidade de morar no Edifício Monte dos Pinheiros, localizado no Parque Faber Castell II, uma das regiões mais valorizadas de São Carlos. Este apartamento foi projetado para oferecer qualidade de vida, contando com ampla área de serviço, armários planejados, cozinha funcional, sala de estar e jantar integradas, além de uma sacada que proporciona momentos de relaxamento. O imóvel dispõe de garagem e portão eletrônico, garantindo segurança e comodidade para você e sua família.
O condomínio oferece infraestrutura completa de lazer e segurança, incluindo portaria 24 horas, elevador, churrasqueira, salão de festas, piscina e playground, ideal para quem busca tranquilidade e diversão sem sair de casa. Aproveite a oportunidade de viver em um apartamento moderno, com excelente localização e fácil acesso a comércios, escolas e serviços. Invista em qualidade de vida e venha conhecer o Edifício Monte dos Pinheiros, a escolha certa para quem busca um imóvel em São Carlos com conforto, segurança e lazer.
Os valores de condomínio e taxas são aproximados. Além do aluguel, será de responsabilidade do locatário o pagamento do condomínio mais as despesas ordinárias, IPTU, Seguro incêndio, energia elétrica e demais encargos previstos nos artigos 22 e 23 da Lei nº 8.245/91.",https://abiasimoveis.com.br/imovel/13415/apartamento-2-quartos-edificio-monte-dos-pinheiros-parque-faber-castell-ii-sao-carlos/
