fonte,codigo,titulo,tipo,subtipo,finalidade,preco_locacao,preco_venda,valor_condominio,valor_iptu,bairro,cidade,estado,endereco,latitude,longitude,dormitorios,suites,banheiros,garagens,area_total,area_construida,area_util,area_terreno,descricao,url
Abias,13421,Casa 3 Quartos Planalto Paraíso 194m²,Casa,,Locacao,"5.000,00",,.,"200,00",Planalto Paraíso,São Carlos,SP,,,,3,1,,4,,,194,,"Excelente oportunidade de aluguel em São Carlos! Esta casa para locação está localizada no bairro Planalto Paraíso, uma região tranquila e bem valorizada, ideal para quem busca conforto e praticidade. Com área útil de 194 m² e terreno de 360 m², o imóvel oferece amplos espaços internos e externos, proporcionando qualidade de vida para toda a família.
A casa conta com 3 dormitórios, sendo 1 suíte, além de 3 banheiros, sala de estar e sala de jantar integradas, perfeitas para receber amigos e familiares. A cozinha é espaçosa e possui armários planejados, despensa e área de serviço independente. O quintal amplo dispõe de churrasqueira, ideal para momentos de lazer, e o imóvel ainda oferece garagem, portão eletrônico e toda a segurança que você procura ao alugar um imóvel.
Se você procura uma casa para alugar em São Carlos, esta é a escolha certa! O imóvel reúne conforto, segurança e localização privilegiada, próximo a comércios, escolas e serviços essenciais. Aproveite esta oportunidade de locação e agende já uma visita para conhecer de perto todos os diferenciais deste imóvel exclusivo no Planalto Paraíso.
Os valores de condomínio e taxas são aproximados. Além do aluguel, será de responsabilidade do locatário o pagamento do condomínio mais as despesas ordinárias, IPTU, Seguro incêndio, energia elétrica e demais encargos previstos nos artigos 22 e 23 da Lei nº 8.245/91.",https://abiasimoveis.com.br/imovel/13421/casa-3-quartos-planalto-paraiso-sao-carlos/
Abias,11236,Loja/Salão Jardim Santa Paula 200m²,Loja/Salão,,Locacao,"5.000,00",,"200,00","250,00",Jardim Santa Paula,São Carlos,SP,,,,,,2,,,,200,,"Procurando um imóvel comercial para expandir seus negócios? Temos uma excelente opção para você! Loja/Salão localizado no bairro Jardim Santa Paula em São Carlos, com uma localização privilegiada e fácil acesso para clientes e funcionários.
O imóvel conta com 2 banheiros, cozinha e vestiários feminino e masculino, além de energia separada para maior comodidade. O bairro oferece uma infraestrutura completa, com bancos, escolas, farmácias, supermercados e instituições de ensino renomadas como Unicep, Usp - Portaria C/IFSC e Usp Campus II.
Não perca essa oportunidade de mudar para um imóvel comercial de qualidade em uma localização estratégica. Entre em contato conosco e agende uma visita!
Os valores de condomínio e taxas são aproximados. Além do aluguel, será de responsabilidade do locatário o pagamento do condomínio mais as despesas ordinárias, IPTU, Seguro incêndio, energia elétrica e demais encargos previstos nos artigos 22 e 23 da Lei nº 8.245/91.",https://abiasimoveis.com.br/imovel/11236/loja_salao-jardim-santa-paula-sao-carlos/
Abias,3537,Casa 4 Quartos Jardim Cardinalli 300m²,Casa,,Locacao,"5.000,00",,.,"280,00",Jardim Cardinalli,São Carlos,SP,,,,4,1,,4,,,300,,"Excelente oportunidade para quem busca alugar uma casa espaçosa em São Carlos! Localizada no bairro Jardim Cardinalli, esta residência de alto padrão oferece 300 m² de área útil em um terreno de 402 m², proporcionando conforto e praticidade para toda a família. Com quatro dormitórios, sendo uma suíte, e quatro banheiros, o imóvel atende perfeitamente às necessidades de quem procura locação de casas amplas e bem distribuídas.
Ao alugar esta casa, você contará com ambientes planejados, como sala de estar, sala de jantar, sala de TV, escritório e uma cozinha funcional com armários e despensa. A área de serviço é ampla e prática, ideal para o dia a dia. O imóvel possui ainda lavabo, garagem e um quintal, perfeito para quem valoriza momentos ao ar livre com privacidade e segurança.
Para completar, a área de lazer é um grande diferencial: churrasqueira e piscina garantem diversão para toda a família e amigos. Esta casa para locação em Jardim Cardinalli é a escolha ideal para quem deseja morar em uma região tranquila de São Carlos, com fácil acesso a comércios, escolas e serviços. Não perca essa oportunidade de alugar um imóvel que une conforto, espaço e qualidade de vida!
Os valores de condomínio e taxas são aproximados. Além do aluguel, será de responsabilidade do locatário o pagamento do condomínio mais as despesas ordinárias, IPTU, Seguro incêndio, energia elétrica e demais encargos previstos nos artigos 22 e 23 da Lei nº 8.245/91.",https://abiasimoveis.com.br/imovel/3537/casa-4-quartos-jardim-cardinalli-sao-carlos/
Abias,7942,Casa 3 Quartos Vila Elizabeth 250m²,Casa,,Locacao,"5.000,00",,.,"300,00",Vila Elizabeth,São Carlos,SP,,,,3,1,,4,,,250,,"Apresentamos uma excelente oportunidade para quem busca casa em São Carlos! Localizada no bairro Vila Elizabeth, esta ampla residência possui 250 m² de área útil em um terreno de 300 m², oferecendo muito espaço, conforto e praticidade para toda a família. Com 3 dormitórios, sendo 1 suíte, e 4 banheiros, o imóvel foi projetado para garantir privacidade e bem-estar aos moradores, além de contar com ambientes bem distribuídos e ótima iluminação natural.
Entre os diferenciais desta casa para locação em São Carlos, destacam-se a área de serviço, armários, cozinha espaçosa, despensa, escritório e edícula, proporcionando praticidade e organização no dia a dia. O imóvel ainda conta com portão eletrônico, garantindo segurança e comodidade, além de quintal amplo, perfeito para momentos de lazer ao ar livre. As salas de estar e jantar são integradas, ideais para receber amigos e familiares com conforto e sofisticação.
Para quem valoriza momentos de lazer, a casa oferece varandas aconchegantes e uma churrasqueira completa, ideal para confraternizações e encontros especiais. Esta é a opção perfeita para quem procura comprar casa em São Carlos com excelente localização, infraestrutura completa e fácil acesso aos principais pontos da cidade. Não perca a oportunidade de morar com qualidade de vida em um dos melhores bairros da região!
Os valores de condomínio e taxas são aproximados. Além do aluguel, será de responsabilidade do locatário o pagamento do condomínio mais as despesas ordinárias, IPTU, Seguro incêndio, energia elétrica e demais encargos previstos nos artigos 22 e 23 da Lei nº 8.245/91.",https://abiasimoveis.com.br/imovel/7942/casa-3-quartos-vila-elizabeth-sao-carlos/
Abias,12066,Casa 3 Quartos Centro 266m²,Casa,,Locacao,"5.000,00",,.,"305,00",Centro,São Carlos,SP,,,,3,2,,4,,,266,,"Descubra esta incrível casa à venda no coração de São Carlos, localizada no Centro, com uma área útil de 266 m² e um amplo terreno de 504 m². Este imóvel é perfeito para quem busca conforto e espaço, oferecendo 3 dormitórios, sendo 2 suítes, ideal para acomodar toda a família com privacidade e comodidade. Com 4 banheiros, a casa conta também com uma área de serviço, despensa e lavabo, garantindo funcionalidade e praticidade no dia a dia.
Aproveite momentos de lazer em suas diversas áreas sociais, incluindo uma espaçosa sala de estar e uma elegante sala de jantar, perfeitas para receber amigos e familiares. A cozinha é equipada com armário, proporcionando organização e facilidade no preparo das refeições. Além disso, o imóvel possui varandas que oferecem uma vista agradável e um quintal que pode ser transformado em um espaço de convivência ao ar livre, ideal para relaxar após um dia corrido.
Segurança e comodidade são prioridades nesta propriedade, que conta com portão eletrônico e garagem para veículos. Não perca a oportunidade de viver em uma das melhores localizações de São Carlos, perto de comércio, escolas e serviços. Esta casa é a escolha perfeita para quem busca qualidade de vida e um lar acolhedor. Entre em contato e agende sua visita!
Os valores de condomínio e taxas são aproximados. Além do aluguel, será de responsabilidade do locatário o pagamento do condomínio mais as despesas ordinárias, IPTU, Seguro incêndio, energia elétrica e demais encargos previstos nos artigos 22 e 23 da Lei nº 8.245/91.",https://abiasimoveis.com.br/imovel/12066/casa-3-quartos-centro-sao-carlos/
Abias,13153,Apartamento 2 Quartos Parque Faber Castell I 79m²,Apartamento,,Locacao,"4.445,00",,"670,00","274,00",Parque Faber Castell I,São Carlos,SP,,,,2,1,,2,,,79,,"Excelente oportunidade de locação em São Carlos! Este apartamento para alugar está localizado no Edifício Vermont, no desejado bairro Parque Faber Castell I. Com 79 m² de área útil, o imóvel oferece um ambiente moderno e confortável, perfeito para quem busca praticidade e qualidade de vida. São 2 dormitórios, sendo 1 suíte, além de 2 banheiros, proporcionando privacidade e comodidade para toda a família.
O apartamento conta com diversos diferenciais que valorizam ainda mais o imóvel: área de serviço, armários planejados, cozinha funcional, sacada, sala de estar e sala de jantar integradas, além de uma vaga de garagem e portão eletrônico para maior segurança. Para quem gosta de receber amigos e familiares, o espaço gourmet com churrasqueira é um convite para momentos especiais.
O condomínio oferece infraestrutura completa para lazer e segurança, incluindo piscina, playground, salão de festas, elevador e portaria 24 horas. Se você procura um apartamento para locação em São Carlos, com fácil acesso, segurança e conforto, esta é a opção ideal. Não perca esta chance de alugar um imóvel pronto para morar no Parque Faber Castell I. Agende sua visita e venha conhecer!
Descubra o conforto e a praticidade de morar no Edifício Vermont, localizado no bairro Parque Faber Castell I, em São Carlos. Este moderno apartamento oferece uma infraestrutura completa para você e sua família, com garagem privativa, portão eletrônico e portaria 24 horas, garantindo segurança e tranquilidade em todos os momentos. O condomínio conta ainda com elevador, facilitando o acesso a todas as áreas, além de um amplo salão de festas para celebrar ocasiões especiais com amigos e familiares.
O lazer é garantido com uma área de churrasqueira perfeita para confraternizações, piscina para os dias de calor e playground ideal para as crianças se divertirem com segurança. O Edifício Vermont está estrategicamente localizado em uma das regiões mais valorizadas de São Carlos, próximo a comércios, escolas e serviços essenciais. Aproveite esta oportunidade para viver em um apartamento que une qualidade de vida, conforto e segurança, ideal para quem busca investir no mercado imobiliário e morar bem.
Os valores de condomínio e taxas são aproximados. Além do aluguel, será de responsabilidade do locatário o pagamento do condomínio mais as despesas ordinárias, IPTU, Seguro incêndio, energia elétrica e demais encargos previstos nos artigos 22 e 23 da Lei nº 8.245/91.",https://abiasimoveis.com.br/imovel/13153/apartamento-2-quartos-edificio-vermont-parque-faber-castell-i-sao-carlos/
Abias,7489,Casa em Condomínio 4 Quartos Condomínio Residencial Quebec 153m²,Casa,,Locacao,"4.800,00",,4,"150,00",Condomínio Residencial Quebec,São Carlos,SP,,,,4,1,,2,,,153,,"Descubra a sua nova casa no Condomínio Residencial Quebec, em São Carlos! Este encantador imóvel possui uma área útil de 153 m² e um amplo terreno de 304 m², oferecendo espaço de sobra para você e sua família. Com 4 dormitórios, sendo 1 suíte, e 3 banheiros, esta residência é perfeita para quem busca conforto e praticidade. A casa conta com uma cozinha arejada, área de serviço, despensa e uma sala de estar aconchegante, ideal para momentos de descontração e convivência.
Além das comodidades internas, a propriedade ainda possui um quintal espaçoso e varandas que proporcionam uma vista agradável e um ambiente relaxante. A garagem com portão eletrônico garante segurança e facilidade no dia a dia. O Condomínio Residencial Quebec é uma excelente escolha para quem valoriza a segurança e a infraestrutura, com portaria 24 horas, playground para as crianças, quadra poliesportiva e salão de festas, tudo pensado para o bem-estar dos moradores.
Não perca a oportunidade de viver em um dos melhores condomínios de São Carlos! Este imóvel é ideal para famílias que buscam qualidade de vida e um ambiente seguro. Entre em contato conosco para agendar uma visita e venha conhecer de perto tudo o que esta casa e o Condomínio Residencial Quebec têm a oferecer. O seu novo lar espera por você!
Descubra o conforto e a segurança de morar em uma casa de condomínio no Condomínio Residencial Quebec, em São Carlos. Este empreendimento oferece uma infraestrutura completa para toda a família, com portaria 24 horas, portão eletrônico e garagem, proporcionando tranquilidade e praticidade no dia a dia. O condomínio conta ainda com áreas de lazer como churrasqueira, playground, quadra poliesportiva e salão de festas, ideais para reunir amigos e familiares em momentos especiais.
O Condomínio Residencial Quebec é a escolha perfeita para quem busca qualidade de vida, segurança e lazer em um ambiente exclusivo. Localizado em uma região valorizada de São Carlos, o empreendimento se destaca no mercado imobiliário por oferecer casas modernas e espaçosas, além de fácil acesso aos principais pontos da cidade. Invista em um imóvel com excelente valorização e desfrute de todo o conforto que você e sua família merecem.
Os valores de condomínio e taxas são aproximados. Além do aluguel, será de responsabilidade do locatário o pagamento do condomínio mais as despesas ordinárias, IPTU, Seguro incêndio, energia elétrica e demais encargos previstos nos artigos 22 e 23 da Lei nº 8.245/91.",https://abiasimoveis.com.br/imovel/7489/casa-em-condominio-4-quartos-condominio-residencial-quebec-condominio-residencial-quebec-sao-carlos/
Abias,10065,Loja/Salão Vila Vista Alegre 150m²,Loja/Salão,,Locacao,"5.000,00",,"200,00","250,00",Vila Vista Alegre,São Carlos,SP,,,,,,2,2,,,150,,"Procurando um salão para o seu negócio na Vila Vista Alegre? Este pode ser o ideal para você! Ele possui:- 2 banheiros;- Cozinha;- Escritório;- 2 Vagas de Garagem;- 150 m² para você utilizar como precisar!Está próximo de mercado, pet shop, lotérica e muitos outros comércios locais!Não perca tempo! Ligue agora e agende uma visita conosco!
Os valores de condomínio e taxas são aproximados. Além do aluguel, será de responsabilidade do locatário o pagamento do condomínio mais as despesas ordinárias, IPTU, Seguro incêndio, energia elétrica e demais encargos previstos nos artigos 22 e 23 da Lei nº 8.245/91.",https://abiasimoveis.com.br/imovel/10065/loja_salao-galeria-sabara-vila-vista-alegre-sao-carlos/
Abias,13131,Casa 3 Quartos Jardim Bandeirantes 295m²,Casa,,Locacao,"5.200,00",,.,"265,00",Jardim Bandeirantes,São Carlos,SP,,,,3,3,,5,,,295,,"Excelente oportunidade de aluguel em São Carlos! Este amplo imóvel está localizado no bairro Jardim Bandeirantes, uma região tranquila e de fácil acesso, próxima à Portaria Principal da USP e à Marginal. Com 295,41 m² de área útil e 420 m² de terreno, esta casa para locação oferece todo o espaço e conforto que você e sua família procuram.
O imóvel conta com 3 dormitórios, todos suítes, além de 6 banheiros bem distribuídos, proporcionando privacidade e praticidade no dia a dia. A área interna inclui sala de estar, sala de jantar, escritório, lavabo, cozinha com armários, despensa e área de serviço. O quintal espaçoso e a sacada são ideais para momentos de lazer e convivência. O portão eletrônico e a garagem garantem segurança e comodidade para sua família.
Se você busca alugar uma casa completa, com excelente localização em São Carlos, esta é a escolha perfeita. Próxima a escolas, supermercados e com fácil acesso ao campus da USP, esta residência reúne todas as características que valorizam o imóvel no mercado de locação. Agende uma visita e descubra o seu novo lar para alugar no Jardim Bandeirantes!
Os valores de condomínio e taxas são aproximados. Além do aluguel, será de responsabilidade do locatário o pagamento do condomínio mais as despesas ordinárias, IPTU, Seguro incêndio, energia elétrica e demais encargos previstos nos artigos 22 e 23 da Lei nº 8.245/91.",https://abiasimoveis.com.br/imovel/13131/casa-3-quartos-jardim-bandeirantes-sao-carlos/
Abias,8036,Casa em Condomínio 3 Quartos Condomínio Faixa Azul 145m²,Casa,,Locacao,"5.000,00",,3,"126,52",Condomínio Faixa Azul,São Carlos,SP,,,,3,1,,2,,,145,,"Excelente oportunidade para quem busca alugar uma casa em condomínio fechado em São Carlos! Esta casa de condomínio está localizada no renomado Condomínio Faixa Azul, oferecendo segurança, conforto e qualidade de vida para você e sua família. Com área útil de 145 m² e terreno de 250 m², o imóvel conta com três dormitórios, sendo uma suíte, além de três banheiros bem distribuídos para garantir praticidade no dia a dia.
O imóvel disponível para locação possui ambientes amplos e bem iluminados, incluindo sala de estar, sala de jantar, cozinha planejada com armários, área de serviço funcional. O quintal espaçoso é perfeito para momentos de lazer, e a churrasqueira garante ótimos encontros com amigos e familiares. Além disso, o portão eletrônico traz mais comodidade e segurança para quem deseja alugar uma casa com infraestrutura completa.
O Condomínio Faixa Azul oferece portaria 24 horas, quadra poliesportiva e salão de festas, proporcionando lazer e tranquilidade para todos os moradores. Se você procura um imóvel para aluguel em São Carlos com excelente localização, segurança e diversas opções de lazer, esta casa de condomínio é a escolha ideal para alugar e viver com qualidade. Entre em contato e agende uma visita!
Descubra o seu novo lar no encantador Condomínio Faixa Azul, em São Carlos. Esta casa de condomínio é o refúgio perfeito para quem busca conforto e segurança, com a conveniência de uma localização privilegiada. Com uma estrutura moderna e acabamentos de qualidade, este imóvel é ideal para famílias que desejam um espaço aconchegante e funcional, onde cada momento se torna especial.
No Condomínio Faixa Azul, você encontrará uma infraestrutura completa que garante qualidade de vida. O empreendimento conta com um Playground para as crianças se divertirem, uma Quadra para a prática de esportes e um Salão de Festas perfeito para celebrar momentos inesquecíveis com amigos e familiares. Além disso, a Portaria 24 horas proporciona a tranquilidade que você merece, garantindo segurança e privacidade para todos os moradores.
Não perca a oportunidade de viver em um ambiente harmonioso e cheio de comodidades. Agende uma visita e venha conhecer de perto esta incrível casa de condomínio no Condomínio Faixa Azul, onde a sua nova vida espera por você. Aproveite essa chance de investimento em um imóvel que combina conforto, segurança e lazer em um só lugar!
Os valores de condomínio e taxas são aproximados. Além do aluguel, será de responsabilidade do locatário o pagamento do condomínio mais as despesas ordinárias, IPTU, Seguro incêndio, energia elétrica e demais encargos previstos nos artigos 22 e 23 da Lei nº 8.245/91.",https://abiasimoveis.com.br/imovel/8036/casa-em-condominio-3-quartos-condominio-faixa-azul-condominio-faixa-azul-sao-carlos/
Abias,8166,Terreno Vila Lutfalla 2.000m²,Terreno,,Locacao,"5.500,00",,.,"150,00",Vila Lutfalla,São Carlos,SP,,,,,,,,2.000,,,,"Procurando um terreno para o seu negócio? Este pode ser o perfeito para você! Ele possui:- 2000 m² para você utilizar como quiser!Está próximo de uma grande concentração de lojas e comércios locais!Não perca tempo! Ligue agora e agende uma visita conosco!
Os valores de condomínio e taxas são aproximados. Além do aluguel, será de responsabilidade do locatário o pagamento do condomínio mais as despesas ordinárias, IPTU, Seguro incêndio, energia elétrica e demais encargos previstos nos artigos 22 e 23 da Lei nº 8.245/91.",https://abiasimoveis.com.br/imovel/8166/terreno-vila-lutfalla-sao-carlos/
Abias,13162,Barracão Jardim Ipanema,Barracão,,Locacao,"5.556,00",,.,"430,00",Jardim Ipanema,São Carlos,SP,,,,,,2,3,,,200,,"Excelente oportunidade de aluguel de barracão no Jardim Ipanema, em São Carlos. Com 200 m² de área útil, este imóvel para locação é ideal para quem busca um espaço amplo e funcional para instalar sua empresa, comércio ou depósito. O barracão conta com estrutura moderna, proporcionando praticidade e conforto para o seu negócio.
O imóvel possui dois banheiros, vestiário feminino e vestiário masculino, além de cozinha, mezanino e garagem. Esses diferenciais tornam o barracão perfeito para atender às necessidades de empresas dos mais diversos segmentos, garantindo comodidade aos colaboradores e visitantes. O mezanino amplia as possibilidades de uso do espaço, otimizando o aproveitamento do imóvel para alugar.
Localizado em região estratégica de São Carlos, o barracão para locação oferece fácil acesso às principais vias da cidade, facilitando a logística e o transporte. Aproveite esta excelente opção de aluguel e estabeleça seu negócio em um imóvel versátil, seguro e pronto para receber sua empresa. Agende já sua visita e conheça de perto todos os benefícios que este barracão pode oferecer!
Os valores de condomínio e taxas são aproximados. Além do aluguel, será de responsabilidade do locatário o pagamento do condomínio mais as despesas ordinárias, IPTU, Seguro incêndio, energia elétrica e demais encargos previstos nos artigos 22 e 23 da Lei nº 8.245/91.",https://abiasimoveis.com.br/imovel/13162/barracao-jardim-ipanema-sao-carlos/
Abias,12297,Casa 4 Quartos Jardim Paraíso 226m²,Casa,,Locacao,"5.334,00",,.,"282,00",Jardim Paraíso,São Carlos,SP,,,,4,2,,2,,,226,,"Descubra a oportunidade perfeita para a sua família em Jardim Paraíso, São Carlos! Esta espaçosa casa, com 226 m² de área útil, oferece 4 dormitórios, sendo 2 suítes, ideal para garantir o conforto e a privacidade de todos os moradores. Com 4 banheiros bem distribuídos, o imóvel proporciona praticidade no dia a dia. A sala de estar e a sala de jantar amplas são perfeitas para momentos de convivência, enquanto a cozinha equipada e a área de serviço facilitam as tarefas domésticas.
Além das comodidades internas, a propriedade conta com um quintal encantador, ideal para crianças brincarem ou para momentos de lazer com amigos e familiares. O imóvel ainda possui dependência de empregada, portão eletrônico e garagem, proporcionando segurança e conforto para o seu dia a dia. Cada detalhe foi pensado para oferecer um lar acolhedor e funcional, atendendo todas as suas necessidades.
Localizada em uma das áreas mais desejadas de São Carlos, a casa em Jardim Paraíso é uma excelente opção para quem busca qualidade de vida e praticidade. Com fácil acesso a escolas, supermercados e áreas de lazer, você estará perto de tudo o que precisa. Não perca a chance de conhecer este imóvel incrível e transformar seus sonhos em realidade. Agende uma visita e venha se encantar com seu novo lar!
Os valores de condomínio e taxas são aproximados. Além do aluguel, será de responsabilidade do locatário o pagamento do condomínio mais as despesas ordinárias, IPTU, Seguro incêndio, energia elétrica e demais encargos previstos nos artigos 22 e 23 da Lei nº 8.245/91.",https://abiasimoveis.com.br/imovel/12297/casa-4-quartos-jardim-paraiso-sao-carlos/
Abias,12983,Barracão Residencial Salto Do Monjolinho 250m²,Barracão,,Locacao,"5.556,00",,.,"73,95",Residencial Salto Do Monjolinho,São Carlos,SP,,,,,,2,4,,,230,,"Excelente oportunidade de aluguel em São Carlos! Este barracão está localizado no bairro Residencial Salto do Monjolinho, uma região estratégica e de fácil acesso, ideal para quem busca praticidade e comodidade. Com 230m² de área útil e 250m² de área total de terreno, o imóvel oferece amplo espaço para instalação de empresas, comércios ou serviços, garantindo versatilidade para o seu negócio.
O barracão para locação conta com ambientes bem distribuídos, incluindo cozinha, garagem, 2 banheiros, além de vestiário feminino e masculino, proporcionando maior conforto e funcionalidade para colaboradores e visitantes. A estrutura é perfeita para quem deseja alugar um imóvel pronto para uso, com toda a infraestrutura necessária para atender às demandas do dia a dia.
Não perca a chance de alugar este barracão em uma das melhores regiões de São Carlos. Imóvel ideal para quem busca locação comercial com excelente custo-benefício, segurança e praticidade. Agende já uma visita e confira de perto todas as vantagens que este espaço pode oferecer para o seu negócio!
Os valores de condomínio e taxas são aproximados. Além do aluguel, será de responsabilidade do locatário o pagamento do condomínio mais as despesas ordinárias, IPTU, Seguro incêndio, energia elétrica e demais encargos previstos nos artigos 22 e 23 da Lei nº 8.245/91.",https://abiasimoveis.com.br/imovel/12983/barracao-residencial-salto-do-monjolinho-sao-carlos/
