fonte,codigo,titulo,tipo,subtipo,finalidade,preco_locacao,preco_venda,valor_condominio,valor_iptu,bairro,cidade,estado,endereco,latitude,longitude,dormitorios,suites,banheiros,garagens,area_total,area_construida,area_util,area_terreno,descricao,url
Abias,10388,Apartamento 2 Quartos Parque Faber Castell I 65m²,Apartamento,,Locacao,"2.556,00",,"515,00","121,00",Parque Faber Castell I,São Carlos,SP,,,,2,1,,1,,,65,,"Descubra o seu novo lar no encantador Parque Faber Castell I, em São Carlos! Este apartamento no Edifício Valentina Park oferece 65 m² de área útil, distribuídos de forma inteligente em 2 dormitórios, sendo 1 suíte, ideal para famílias ou casais que buscam conforto e praticidade. Com 2 banheiros, o imóvel conta ainda com uma área de serviço, cozinha equipada e armários planejados, garantindo funcionalidade e organização no seu dia a dia.
O apartamento possui uma ampla sala de estar e uma aconchegante sala de jantar, perfeitas para momentos de convivência e lazer. A sacada proporciona um espaço extra para relaxar e apreciar a vista, enquanto a churrasqueira é ideal para receber amigos e familiares. Além disso, o imóvel conta com garagem, portão eletrônico e segurança 24 horas, oferecendo tranquilidade e proteção para você e sua família.
O Edifício Valentina Park ainda oferece uma infraestrutura completa para o seu lazer e bem-estar. Desfrute de uma refrescante piscina, um divertido playground para as crianças, uma sala de ginástica para manter a forma e um salão de festas para celebrar momentos especiais. Com elevador e portaria 24 horas, você terá toda a comodidade e segurança que merece. Não perca a oportunidade de viver em um local que une qualidade de vida e praticidade, agende uma visita e venha conhecer seu novo lar!
Excelente oportunidade de aluguel em São Carlos! Este apartamento para locação está situado no Edifício Valentina Park, no bairro Parque Faber Castell I, uma das regiões mais valorizadas da cidade. Com 65 m² de área útil, o imóvel apresenta uma planta moderna e funcional, composta por 2 dormitórios, sendo 1 suíte, além de 2 banheiros bem distribuídos. Ideal para quem busca alugar um apartamento confortável, seguro e com fácil acesso aos principais pontos da cidade.
O apartamento conta com áreas integradas de sala de estar e jantar, sacada, cozinha planejada com armários, área de serviço e uma vaga de garagem. O condomínio oferece infraestrutura completa para lazer e segurança, incluindo portaria 24 horas, portão eletrônico, elevador, piscina, playground, salão de festas, churrasqueira e sala de ginástica. Tudo pensado para proporcionar praticidade, bem-estar e qualidade de vida para você e sua família.
Se você procura um imóvel para locação em São Carlos, este apartamento é a escolha perfeita para quem deseja morar bem, com conforto e segurança. Aproveite esta oportunidade de alugar um apartamento em um condomínio completo, em localização privilegiada e com excelente custo-benefício. Agende já sua visita e venha conhecer seu novo lar!
Os valores de condomínio e taxas são aproximados. Além do aluguel, será de responsabilidade do locatário o pagamento do condomínio mais as despesas ordinárias, IPTU, Seguro incêndio, energia elétrica e demais encargos previstos nos artigos 22 e 23 da Lei nº 8.245/91.",https://abiasimoveis.com.br/imovel/10388/apartamento-2-quartos-edificio-valentina-park-parque-faber-castell-i-sao-carlos/
Abias,12524,Apartamento 2 Quartos Parque Sabara 68m²,Apartamento,,Locacao,"2.445,00",,"578,42","179,00",Parque Sabara,São Carlos,SP,,,,2,1,,1,,,68,,"Excelente oportunidade de aluguel em São Carlos! Este apartamento para locação está localizado no Edifício Vila Verde Sabará, no bairro Parque Sabará, oferecendo uma área útil de 68m² muito bem distribuída. O imóvel conta com 2 dormitórios, sendo 1 suíte, além de 2 banheiros, proporcionando conforto e privacidade para toda a família. Os ambientes são amplos e bem iluminados, com sala de estar e sala de jantar integradas, sacada aconchegante e área de serviço funcional.
Ao alugar este apartamento, você terá à disposição uma cozinha planejada com armários, garagem coberta para maior comodidade e portão eletrônico, garantindo segurança e praticidade no dia a dia. O condomínio oferece uma infraestrutura completa para lazer e segurança, incluindo churrasqueira, piscina, playground, salão de festas e portaria 24 horas, além de elevador para facilitar o acesso aos andares.
Se você procura um imóvel para locação em São Carlos, esta é a opção ideal para morar com conforto, segurança e qualidade de vida. O Edifício Vila Verde Sabará está localizado em uma região tranquila e de fácil acesso, próximo a comércios, escolas e serviços essenciais. Não perca a chance de alugar este apartamento e viver com toda a comodidade que sua família merece. Agende uma visita e conheça seu novo lar!
Descubra o conforto e a segurança de morar no Edifício Vila Verde Sabará, um empreendimento moderno localizado no bairro Parque Sabará, em São Carlos. Este apartamento oferece uma infraestrutura completa para você e sua família, com portão eletrônico, portaria 24 horas e diversas opções de lazer, como piscina, playground, churrasqueira e salão de festas. Aqui, você encontra o equilíbrio perfeito entre tranquilidade, praticidade e qualidade de vida, em um dos bairros mais valorizados da cidade.
O Edifício Vila Verde Sabará foi pensado para proporcionar bem-estar e comodidade, atendendo às necessidades do mercado imobiliário de São Carlos. O empreendimento se destaca pela excelente localização, fácil acesso aos principais pontos da cidade e infraestrutura de lazer completa. Ideal para quem busca apartamentos à venda em São Carlos com segurança, lazer e conforto, o Vila Verde Sabará é a escolha certa para viver momentos inesquecíveis com sua família.
Os valores de condomínio e taxas são aproximados. Além do aluguel, será de responsabilidade do locatário o pagamento do condomínio mais as despesas ordinárias, IPTU, Seguro incêndio, energia elétrica e demais encargos previstos nos artigos 22 e 23 da Lei nº 8.245/91.",https://abiasimoveis.com.br/imovel/12524/apartamento-2-quartos-edificio-vila-verde-sabara-parque-sabara-sao-carlos/
Abias,13248,Apartamento 2 Quartos Cidade Jardim 50m²,Apartamento,,Locacao,"2.778,00",,"446,96","91,72",Cidade Jardim,São Carlos,SP,,,,2,1,,1,,,50,,"Descubra a oportunidade de alugar um excelente apartamento no Edifício Loomi Cidade Jardim, localizado em um dos bairros mais valorizados de São Carlos. Com 50 m² de área útil, este imóvel oferece dois dormitórios, sendo uma suíte, além de dois banheiros bem distribuídos. O apartamento conta com sala de estar e jantar integradas, sacada, cozinha planejada com armários, área de serviço e uma vaga de garagem, proporcionando conforto e praticidade para o seu dia a dia.
Ideal para quem busca locação em uma região estratégica, o edifício está próximo à Ufscar e ao acesso principal da USP, facilitando a rotina de estudantes e profissionais. O condomínio oferece portão eletrônico, elevador, salão de festas, churrasqueira, piscina e portaria, garantindo lazer, segurança e comodidade para toda a família. Aproveite a infraestrutura completa para viver com qualidade e tranquilidade em São Carlos.
Se você procura um imóvel para alugar em Cidade Jardim, esta é a escolha perfeita para quem valoriza localização privilegiada e conforto. Não perca a chance de morar em um apartamento moderno, com fácil acesso às principais vias da cidade e próximo a universidades e serviços essenciais. Agende uma visita e venha conhecer seu novo lar para locação em São Carlos!
Excelente oportunidade de aluguel em São Carlos! Localizado no moderno Edifício Loomi Cidade Jardim, este apartamento para locação oferece conforto e praticidade em uma das regiões mais valorizadas da cidade. Com 50m² de área útil, o imóvel conta com 2 dormitórios, sendo 1 suíte, além de banheiro social, ideal para quem busca alugar um apartamento funcional e bem distribuído.
O condomínio dispõe de infraestrutura completa para o seu bem-estar e lazer, incluindo portão eletrônico, churrasqueira, salão de festas, piscina e elevador, proporcionando praticidade e segurança para o dia a dia. A localização é estratégica, próximo à UFSCar, USP (Portaria Observatório) e à movimentada Avenida Dr. Carlos Botelho, facilitando o acesso às principais vias, comércios, escolas e universidades da região.
Se você procura um apartamento para alugar em São Carlos, esta é a escolha perfeita para estudantes, profissionais e famílias que desejam morar em um ambiente agradável, seguro e com excelente custo-benefício. Aproveite esta oportunidade de locação e agende uma visita para conhecer de perto este imóvel diferenciado no Cidade Jardim!
Os valores de condomínio e taxas são aproximados. Além do aluguel, será de responsabilidade do locatário o pagamento do condomínio mais as despesas ordinárias, IPTU, Seguro incêndio, energia elétrica e demais encargos previstos nos artigos 22 e 23 da Lei nº 8.245/91.",https://abiasimoveis.com.br/imovel/13248/apartamento-2-quartos-edificio-loomi-cidade-jardim-cidade-jardim-sao-carlos/
Abias,9375,Casa 3 Quartos Residencial Samambaia 170m²,Casa,,Locacao,"3.000,00",,"160,00","70,00",Residencial Samambaia,São Carlos,SP,,,,3,1,,2,,,170,,"Descubra o seu novo lar no Residencial Samambaia, em São Carlos! Esta encantadora casa oferece uma ampla área útil de 170 m² e um terreno de 250 m², proporcionando espaço de sobra para você e sua família. Com 3 dormitórios, sendo 1 suíte, e 3 banheiros, este imóvel é perfeito para quem busca conforto e praticidade. A sala de estar e a sala de jantar são ideais para momentos de convivência, enquanto o escritório oferece um espaço tranquilo para trabalhar ou estudar em casa.
A cozinha equipada, a área de serviço e o lavabo garantem funcionalidade no dia a dia, O quintal é um convite para o lazer ao ar livre, perfeito para crianças brincarem ou para receber amigos e familiares em um churrasco. Além disso, o condomínio conta com um playground, ideal para a diversão dos pequenos, tudo em um ambiente seguro e acolhedor.
Não perca a oportunidade de viver em uma das melhores localizações de São Carlos! Esta casa no Residencial Samambaia é uma excelente opção para quem busca qualidade de vida, com fácil acesso a serviços, comércio e escolas. Agende sua visita e venha conhecer seu novo lar, onde conforto e praticidade se encontram em um só lugar!
Os valores de condomínio e taxas são aproximados. Além do aluguel, será de responsabilidade do locatário o pagamento do condomínio mais as despesas ordinárias, IPTU, Seguro incêndio, energia elétrica e demais encargos previstos nos artigos 22 e 23 da Lei nº 8.245/91.",https://abiasimoveis.com.br/imovel/9375/casa-3-quartos-residencial-samambaia-sao-carlos/
Abias,12543,Apartamento 2 Quartos Jardim Gibertoni 62m²,Apartamento,,Locacao,"2.790,00",,"376,48","83,97",Jardim Gibertoni,São Carlos,SP,,,,2,1,,1,,,62,,"Descubra seu novo lar no coração do Jardim Gibertoni, em São Carlos. Este encantador apartamento no Edifício Eco Residence oferece 62 m² de área útil, ideal para quem busca conforto e praticidade. Com 2 dormitórios, sendo 1 suíte, e 2 banheiros, com sacada gourmet este imóvel é perfeito para famílias ou casais que desejam um espaço aconchegante e bem distribuído. A localização privilegiada proporciona fácil acesso a diversas comodidades da cidade, garantindo qualidade de vida e conveniência no dia a dia.
O Edifício Eco Residence conta com uma série de amenidades que elevam o padrão de vida dos seus moradores. Desfrute da segurança e tranquilidade proporcionadas pelo portão eletrônico e aproveite momentos de lazer no salão de festas, ideal para confraternizações com amigos e familiares. Além disso, o prédio possui elevador, facilitando o acesso a todos os andares e garantindo conforto para todos os moradores.
Não perca a oportunidade de viver em um apartamento que une modernidade e praticidade. Com uma excelente relação custo-benefício, este imóvel é uma escolha inteligente para quem deseja investir em qualidade de vida. Agende uma visita hoje mesmo e venha conhecer seu novo lar no Jardim Gibertoni, São Carlos. Este apartamento é a combinação perfeita de conforto, segurança e localização, pronto para receber você e sua família!
Descubra o conforto e a praticidade de viver no Edifício Eco Residence, localizado no bairro Jardim Gibertoni em São Carlos. Este moderno empreendimento residencial oferece apartamentos projetados para proporcionar qualidade de vida, segurança e bem-estar. Com portão eletrônico e elevador, os moradores desfrutam de toda a comodidade e segurança que você e sua família merecem. O condomínio conta ainda com uma completa sala de ginástica e um amplo salão de festas, perfeitos para manter o estilo de vida saudável e celebrar momentos especiais com amigos e familiares.
O Edifício Eco Residence está estrategicamente situado em uma região valorizada de São Carlos, próximo a comércios, escolas, supermercados e vias de acesso, facilitando o dia a dia dos moradores. Este empreendimento é ideal para quem busca apartamentos à venda em São Carlos com infraestrutura completa, segurança e lazer. Invista em qualidade de vida e aproveite todas as vantagens de morar em um condomínio moderno, que une conforto, praticidade e localização privilegiada. Agende sua visita e conheça o seu novo lar no Jardim Gibertoni!
Os valores de condomínio e taxas são aproximados. Além do aluguel, será de responsabilidade do locatário o pagamento do condomínio mais as despesas ordinárias, IPTU, Seguro incêndio, energia elétrica e demais encargos previstos nos artigos 22 e 23 da Lei nº 8.245/91.",https://abiasimoveis.com.br/imovel/12543/apartamento-2-quartos-edificio-eco-residence-jardim-gibertoni-sao-carlos/
Abias,13142,Apartamento 3 Quartos Vila Monteiro (Gleba I) 120m²,Apartamento,,Locacao,"2.000,00",,"1.150,00","109,00",Vila Monteiro (Gleba I),São Carlos,SP,,,,3,1,,1,,,120,,"Excelente oportunidade de aluguel em São Carlos! Este amplo apartamento para locação está localizado no Edifício Rosa de Prata, no bairro Vila Monteiro (gleba I), uma das regiões mais valorizadas da cidade. Com 120m² de área útil, o imóvel oferece todo o conforto e praticidade que você e sua família procuram, ideal para quem deseja alugar um apartamento espaçoso e bem localizado.
O apartamento conta com 3 dormitórios, sendo 1 suíte, 3 banheiros, sala de estar e sala de jantar, proporcionando ambientes integrados e aconchegantes. A cozinha possui armários e há uma área de serviço funcional, além de dependência de empregada. Para sua comodidade, o imóvel dispõe de garagem, portão eletrônico e uma agradável sacada, perfeita para momentos de lazer e relaxamento.
O condomínio oferece infraestrutura completa para quem busca segurança e lazer ao alugar um imóvel. Com portaria 24 horas, elevador, salão de festas e excelente localização, o Edifício Rosa de Prata é a escolha ideal para quem valoriza qualidade de vida. Aproveite esta oportunidade de locação e agende já sua visita para conhecer esse apartamento disponível para aluguel em São Carlos!
Descubra o Edifício Rosa de Prata, um empreendimento residencial de alto padrão localizado na valorizada região de Vila Monteiro (Gleba I), em São Carlos. Este apartamento oferece todo o conforto e segurança que você e sua família merecem, com garagem privativa, portão eletrônico, elevador moderno e portaria 24 horas, garantindo tranquilidade e praticidade no seu dia a dia. O edifício foi projetado para proporcionar uma excelente experiência de moradia, combinando localização estratégica com estrutura completa.
O Edifício Rosa de Prata destaca-se no mercado imobiliário por oferecer um salão de festas espaçoso, perfeito para receber amigos e familiares em momentos especiais. Próximo a escolas, supermercados e com fácil acesso às principais vias da cidade, este apartamento é ideal para quem busca qualidade de vida e valorização imobiliária. Aproveite a oportunidade de morar em um dos melhores bairros de São Carlos, em um condomínio seguro e bem administrado, pensado para o seu bem-estar e conforto.
Os valores de condomínio e taxas são aproximados. Além do aluguel, será de responsabilidade do locatário o pagamento do condomínio mais as despesas ordinárias, IPTU, Seguro incêndio, energia elétrica e demais encargos previstos nos artigos 22 e 23 da Lei nº 8.245/91.",https://abiasimoveis.com.br/imovel/13142/apartamento-3-quartos-edificio-rosa-de-prata-vila-monteiro-(gleba-i)-sao-carlos/
Abias,5042,Apartamento 2 Quartos Parque Arnold Schimidt 78m²,Apartamento,,Locacao,"2.445,00",,"732,06","93,00",Parque Arnold Schimidt,São Carlos,SP,,,,2,1,,1,,,78,,"Excelente oportunidade de locação! Este apartamento para alugar está localizado no Loteamento São Carlos Club, no Edifício Jatobá, uma das regiões mais valorizadas de São Carlos. Com 78 m² de área útil, o imóvel oferece ambientes amplos e bem distribuídos, perfeito para quem busca conforto e praticidade. São 2 dormitórios, sendo 1 suíte, além de 2 banheiros, proporcionando privacidade e comodidade para toda a família.
O apartamento disponível para aluguel conta com uma área de serviço funcional, armários planejados, cozinha espaçosa e sacada, ideal para momentos de lazer e relaxamento. Para sua segurança e tranquilidade, o prédio possui portão eletrônico, garagem e elevador, além de estar próximo à USP – Portaria ICMC – Matemática, facilitando o acesso para estudantes e profissionais da região.
O condomínio oferece ainda salão de festas, um diferencial para quem gosta de receber amigos e familiares. Se você procura um apartamento para locação em São Carlos, com excelente localização e infraestrutura completa, esta é a opção ideal. Não perca essa chance de alugar um imóvel que une conforto, segurança e praticidade. Agende já sua visita e venha conhecer!
Descubra o conforto e a praticidade de viver no Edifício Jatobá, um empreendimento residencial localizado no bairro Parque Arnold Schimidt, em São Carlos. Este apartamento oferece segurança e tranquilidade com portão eletrônico, proporcionando mais proteção para você e sua família. Situado em uma região valorizada, o imóvel está próximo à Usp - Portaria ICMC - Matemática, ideal para estudantes, professores e profissionais que buscam facilidade de acesso à universidade e aos principais pontos da cidade.
O Edifício Jatobá se destaca no mercado imobiliário de São Carlos por sua excelente localização, infraestrutura moderna e ambiente acolhedor. Morar aqui significa estar cercado de conveniências, como supermercados, farmácias, escolas e áreas de lazer, além de contar com transporte público acessível. Não perca a oportunidade de investir em um apartamento que une qualidade de vida, segurança e valorização imobiliária. Agende uma visita e conheça de perto todos os benefícios que este empreendimento exclusivo pode oferecer para você!
Os valores de condomínio e taxas são aproximados. Além do aluguel, será de responsabilidade do locatário o pagamento do condomínio mais as despesas ordinárias, IPTU, Seguro incêndio, energia elétrica e demais encargos previstos nos artigos 22 e 23 da Lei nº 8.245/91.",https://abiasimoveis.com.br/imovel/5042/apartamento-2-quartos-edificio-jatoba-parque-arnold-schimidt-sao-carlos/
Abias,2644,Loja/Salão Jardim Bandeirantes 115m²,Loja/Salão,,Locacao,"3.200,00",,"100,00","100,00",Jardim Bandeirantes,São Carlos,SP,,,,,,2,6,,,115,,"Descubra a oportunidade perfeita para o seu negócio com esta loja/salão disponível para venda no Jardim Bandeirantes, em São Carlos. Com uma área útil de 115,43 m² e um terreno amplo de 336,54 m², este imóvel oferece espaço suficiente para diversas atividades comerciais, desde lojas de varejo até escritórios. A localização estratégica no Jardim Bandeirantes garante alta visibilidade e fácil acesso, ideal para atrair clientes e impulsionar suas vendas.
Este imóvel conta com 2 banheiros, proporcionando conforto e praticidade para seus funcionários e clientes. A planta flexível permite que você personalize o espaço de acordo com as necessidades do seu negócio, tornando-se um excelente investimento para quem deseja empreender ou expandir suas operações. Não perca a chance de adquirir um imóvel bem localizado e com grande potencial de valorização no mercado imobiliário de São Carlos.
Se você está em busca de um imóvel comercial que una espaço, localização e potencial de crescimento, esta loja/salão no Jardim Bandeirantes é a escolha ideal. Entre em contato conosco para mais informações e agende uma visita. Aproveite essa oportunidade única de investir em um espaço que pode se tornar o novo lar do seu negócio!
Os valores de condomínio e taxas são aproximados. Além do aluguel, será de responsabilidade do locatário o pagamento do condomínio mais as despesas ordinárias, IPTU, Seguro incêndio, energia elétrica e demais encargos previstos nos artigos 22 e 23 da Lei nº 8.245/91.",https://abiasimoveis.com.br/imovel/2644/loja_salao-jardim-bandeirantes-sao-carlos/
Abias,13337,Casa 2 Quartos Planalto Paraíso 120m²,Casa,,Locacao,"3.334,00",,"160,00","200,00",Planalto Paraíso,São Carlos,SP,,,,2,1,,1,,,120,,"Excelente oportunidade de aluguel em São Carlos! Esta casa para locação está localizada no bairro Planalto Paraíso, uma região tranquila e de fácil acesso, perfeita para quem busca conforto e praticidade no dia a dia. Com 120 m² de área útil, o imóvel oferece ambientes amplos e bem distribuídos, ideal para famílias que desejam alugar uma residência espaçosa e funcional.
O imóvel conta com 2 dormitórios, sendo 1 suíte, além de 4 banheiros, proporcionando privacidade e comodidade para todos os moradores. A casa possui sala de estar aconchegante, cozinha ampla, área de serviço, sacada, quintal espaçoso e garagem. Todos os ambientes são bem iluminados e ventilados, garantindo uma experiência de moradia agradável e confortável.
Se você procura uma casa para alugar em São Carlos, esta é a opção ideal! Aproveite a chance de morar em um imóvel completo, com excelente localização e infraestrutura. Entre em contato e agende uma visita para conhecer de perto todas as vantagens desta casa disponível para locação no Planalto Paraíso.
Os valores de condomínio e taxas são aproximados. Além do aluguel, será de responsabilidade do locatário o pagamento do condomínio mais as despesas ordinárias, IPTU, Seguro incêndio, energia elétrica e demais encargos previstos nos artigos 22 e 23 da Lei nº 8.245/91.",https://abiasimoveis.com.br/imovel/13337/casa-2-quartos-planalto-paraiso-sao-carlos/
Abias,10831,Ponto Comercial Vila Monteiro (Gleba I) 280m²,Ponto,,Locacao,"3.334,00",,.,"100,00",Vila Monteiro (Gleba I),São Carlos,SP,,,,,,2,,,,280,,"Este ponto comercial é uma oportunidade única para quem busca um espaço amplo e bem localizado em São Carlos. Com 280m² de área útil, o imóvel conta com 2 banheiros, armários, cozinha, escritório e vestiários feminino e masculino.
Localizado na Vila Monteiro (Gleba I), este ponto comercial é ideal para quem deseja expandir seus negócios ou iniciar um novo empreendimento. Com uma infraestrutura completa e moderna, o imóvel oferece todo o conforto e praticidade que você precisa para atender seus clientes e colaboradores.
Além disso, o ponto comercial está disponível tanto para venda quanto para locação. Não perca a oportunidade de investir em um imóvel de qualidade e com excelente custo-benefício. Agende agora mesmo uma visita e confira de perto todas as vantagens que este imóvel pode oferecer.
Os valores de condomínio e taxas são aproximados. Além do aluguel, será de responsabilidade do locatário o pagamento do condomínio mais as despesas ordinárias, IPTU, Seguro incêndio, energia elétrica e demais encargos previstos nos artigos 22 e 23 da Lei nº 8.245/91.",https://abiasimoveis.com.br/imovel/10831/ponto-comercial-vila-monteiro-(gleba-i)-sao-carlos/
